{
  "artifact_sha256": "3333333333333333333333333333333333333333333333333333333333333333",
  "build_commit": "0000000000000000000000000000000000000000",
  "config_bundle_sha256": "2222222222222222222222222222222222222222222222222222222222222222",
  "contract_manifest_sha256": "1111111111111111111111111111111111111111111111111111111111111111",
  "emitted_at_us": 1786156800123456,
  "event_id": "evt_triad_transport_bindings_v1",
  "event_kind": "TRANSPORT_BINDINGS",
  "payload": {
    "bindings": [
      {
        "consumers": [
          "x-consumer"
        ],
        "exact_binding": "x.exact",
        "logical_topic": "x.logical",
        "owner": "x-owner",
        "transport_kind": "TOPIC"
      }
    ],
    "bindings_digest": "0000000000000000000000000000000000000000000000000000000000000000",
    "bindings_id": "x-bindings",
    "revision": "1",
    "unknown_binding_refusal": "TRANSPORT_BINDING_UNKNOWN"
  },
  "producer_instance_id": "inst_golden_01",
  "producer_service": "contract-governance",
  "schema": "triad.transport_bindings.v1",
  "schema_version": "1.0.0"
}
